filename,caption
fire (56).png,"A large fire rages through the forest next to an oil pipeline while an adult male firefighter stands ready with a drip torch, appearing to manage the daytime blaze."
tractor (142).jpg,"Several tractors, including a silver Eicher tractor stuck in thick mud in the foreground, a red tractor, and a green tractor, are positioned on a muddy field under a cloudy sky, with a yellow bulldozer visible in the background."
sports_car (362).jpg,A man in a suit drives a green convertible car along a tree-lined road during the daytime.
concrete_truck (32).jpg,A orange concrete mixer truck with the word 'steel' printed prominently on the drum is parked at a construction site on a sunny day.
rv (460).jpg,An adult male eats from a bowl while leaning against a white camper van parked outdoors. 
fire_truck (307).jpg,A red E4 fire truck drives on a narrow road during daytime with sedans parked on the right side.
bicycle (460).png,A group of people are walking down a street with a man riding a bike in the middle.
m11_ppe (137).jpg,"Two adult males wearing white shirts and blue bib overalls smile while working indoors during daytime, with the man on the left wearing black earmuffs and holding something in front of him, and the man on the right wearing blue earmuffs and holding a metal power tool beside him."
airplane (33).jpg,"A large, grey, four-engine airplane with high-mounted wings and a smaller, grey, twin-tailed airplane fly through a clear blue sky during the daytime, with the twin-tailed airplane positioned above and to the left of the four-engine airplane."
m6_ppe (212).jpg,A man wearing a white safety helmet and a yellow and orange safety harness stands with his back turned during the day.
uv (310).jpg,A bright green electric shuttle with passengers drives along a sunny coastal road lined with palm trees and a view of the ocean.
stealing_person (76).jpg,"Two young men are engaged in a struggle, with one holding a knife defensively while the other attempts to disarm him."
jeep (364).jpg,"A dirty white  Jeep with a roof rack and white roof   stops on a dirt courtyard, surround by mud-and-thatch houses, severla adult person, village setting during daytime."
sitting_person (333).jpg,Three women are sleeping at their desks in an office environment under a timestamp of 09-25-2023 and 20:37:33.
crane_truck (171).jpg,A white Hyundai truck equipped with a white crane arm stands parked while a man inspects the tire during the daytime.
bird (184).jpg,"A gray pigeon stands in the shade below a building, bending its head down to look at food in front of it during the daytime."
airplane (496).jpg,"A white Scandinavian Airlines (SAS) jet, featuring the white text ""SAS"" on the dark blue tail and the red text ""Scandinavian Airlines"" on the fuselage with an orange engine casing, sits on the tarmac near an airport vehicle and buildings under a pale grey sky."
motorbike (428).jpg,A white and black motorbike is parked in a garage with several other motorbikes in the background.
fuel_truck (24).jpg,A white fuel truck with 'FLAMMABLE' and 'KEEP DISTANCE' warnings is parked near a white 'ICELANDAIR' airplane on an airport tarmac under a dark and cloudy sky.
smoke (426).jpg,A large amount of smoke billows into the sky above a dark landscape with a tall tower on the left during daytime.
holdingGun_person (396).jpg,An adult man in a black T-shirt with Marilyn Monroe on it and a black hooded zip-up is looking around with a gun.
truck (67).jpg,A silver cargo truck with a tall metal side frame is parked in an industrial area during daytime.
m11_ppe (429).jpg,"During the day, an adult man in a white helmet, glasses, a blue mask, gloves with gray palms and white wrists, a red safety vest, an orange life jacket, light gray pants, and black shoes stands sideways with his left hand raised shoulder-high."
holdingGun_person (157).jpg,"An adult man wearing a black short-sleeve shirt and black shorts with the enemy SK is explaining, and an adult man wearing black short-sleeve shirt and black shorts is positioned to stab with a model knife."
crane_truck (202).jpg,A white Hyundai truck equipped with a red crane arm stands parked on a dirt lot during the daytime.
limousine (185).jpg,"Three stretch limousines, including a white and a black Hummer, are parked in the snow with large, white, snow-covered mountains visible in the background during the daytime ."
dog (206).jpg,A little girl is sitting on the grass with her dog.
bicycle (469).png,"A group of people walking and biking down a street, with some of them carrying umbrellas."
jeep (216).jpg,"A Toyota's deep blue with white roof number plate P  1063 6AJeeps moves dusty ground, a person wearing a red jacket and , a hat and sunglasses sit in the passenger seat,  a person wearing a beanie is sit in the driver's seat, many other Jeep stops lined up behind, steep green mountains background during the daytime."
police_car (364).jpg,A white police van is parked in front of a building.
van (204).jpg,"Behind a slim blue pole bearing a sign that reads “Arthur Serino Square,” a white van with writing on its body is parked; the road has a short crosswalk, and in the background stand a dark red brick building and several trees."
recycling_truck (260).jpg,A man dressed as Santa Claus is standing on the back of a garbage truck.
smoke (401).jpg,"A large amount of smoke rises from a hillside during the daytime, obscuring a section of the charred, cultivated landscape."
ship (404).jpeg,A large white cruise ship named AIDABlu with blue wave graphics and multiple balcony decks is docked under a clear blue sky with small figures walking along the pier below.
police_car (82).jpg,A busy street with a HYUNDAI police car in the middle of the scene.
license_plate (212).jpg,A white vehicle is parked indoors at night with a white license plate displaying 278두 7088 and a blue country badge while the black patterned grille sits behind the plate.
m11_ppe (439).jpg,"During the day, he stands slightly sideways with his white helmet, glasses, blue mask, gray pants, gloves with gray palms and white wrists, fluorescent yellow and black vests with name tags on top of his gray short-sleeve shirt, turning slightly, his hands shoulder-high, and his pants hanging with a walkie-talkie."
pickup_truck (178).jpg,"On a wide road, a light gray pickup truck faces away on the left, a blue truck with a brown cloth over its cargo faces forward in the center, and a masked adult on a red motorcycle stands on the right."
stealing_person (309).jpg,"Several people observe two individuals engaged in a ground grappling demonstration in an outdoor, sunlit area."
m5_ppe (155).jpg,"A person in an orange long-sleeved work uniform is holding a tool and working, while wearing gray gloves with a black coating."
fighting_person (364).jpg,"At night, an adult man wearing a red cap and another adult man in a white short-sleeved shirt are angrily pointing fingers at each other and fighting, while a person wearing a police vest and helmet is holding back the man in the white shirt."
smoke (149).jpg,A small amount of white smoke drifts from a large pile of cut logs and burned debris in a deforested area during daytime.
crane_truck (129).jpg,A crawler crane with a lattice boom dredges sand onto a barge floating on the water during the daytime.
fire (297).png,An adult male firefighter with a backpack uses a drip torch to start a small fire in a smoky forest during the daytime.
motorbike (437).jpg,Three adult males pose with a white motorbike in an outdoor market filled with many other motorbikes during the daytime.
suitcase (352).jpg,It's very crowded with people in broad daylight.
stealing_person (284).jpg,A woman with glasses holds a lit green lighter to a young boy's cigarette.
m5_ppe (430).jpg,"A man in his 20s, wearing a white helmet, a lime-green vest, a white long-sleeved shirt, brown gloves, and black pants, is standing on a rooftop in the evening."
ambulance (484).jpg,A medium ambulance van shows plate 9981263; no people are visible.
bird (482).jpg,A green parrot stares toward the camera inside a bright room.
forklift (70).jpg,An adult operates a red forklift inside an industrial warehouse with a grey FAUN truck nearby during the daytime. 
helicopter (157).jpg,"A gray medium-sized helicopter with a four-leaf propeller, a four-leaf tail rotor method, two large wheels on each side of the front and one small wheel in the center of the back flies over the sea, and a warship with a helicopter landing site floats in the sea."
road_roller (340).jpg,"A used yellow Volvo tamping foot road roller with an open canopy, designed for compacting cohesive soils, is working on a dirt path during the day, operated by an adult male in a white shirt."
m6_ppe (82).jpg,A middle-aged woman in a fluorescent yellow vest and black boots bends one leg and turns slightly to look diagonally ahead.  
cat (364).jpg,"A grey and white tabby cat drinks from the small, round basin of a large, modern white automatic water dispenser."
quad (203).jpg,A man wearing a cap and a dark jacket drives a red all-terrain vehicle with a large light-colored dog standing on the rear rack across a rolling green pasture during a golden sunset.
fuel_truck (102).jpg,"A white 'SCHENK' fuel truck is driving under a large concrete and metal gantry, with extensive red and silver piping and storage tanks visible under a partly cloudy sky during the daytime."
pickup_truck (462).jpg,"Glossy pickup trucks, mostly white except for a navy second one, stand in a line showing their rear profiles on a factory production line under a ceiling lined with lights and yellow fans, while the two nearest trucks have their hoods open and an adult woman in a green top and jeans stands before the navy vehicle."
m7_ppe (290).jpg,"A man with a beard, wearing a plaid shirt and a clear face shield, looks to his right in a workshop setting."
pickpocketing_person (252).jpg,"While a woman in a backless yellow dress walks with a red bag, another person steals her wallet in daytime."
holdingGun_person (493).jpg,An adult man wearing a black hat and a dark green cord is shooting in the evening.
suitcase (485).jpg,"A woman is walking, pulling a small black carrier."
car (48).jpg,"In daylight, one black sedan is driving to the right on the road, while one white SUV is passing in the opposite lane."
crane_truck (24).jpg,A crane operates on a flat barge floating on the river during the daytime.
sports_car (342).jpg,A white Chevrolet Corvette race car with racing stripes and the number 16 sits on grassy ground under a daytime sky while people attend to it near a trailer and other vehicles.
crane_truck (264).jpg,A white Hyundai New Power Truck equipped with an orange crane arm stands parked on a dirt surface during the daytime.
train (393).jpg,A black freight train rolls by while a person hangs onto a car in daytime.
pickpocketing_person (235).jpg,"Two adults on a daytime street, one wearing a gray hoodie and jeans, as another hand reaches into her backpack to steal a phone."
fire_truck (184).jpg,A red Talleyville fire truck with a ladder mounted on top drives along the road in daylight.
dog (317).jpg,A white dog and a child is playing in the yard.
fuel_truck (405).jpg,"Two white semi-trucks are parked side-by-side with their white tankers in a fuel storage yard, surrounded by numerous massive white storage tanks under a cloudy blue sky during the daytime."
m7_ppe (126).jpg,"A grainy, full view shows an orange safety vest with grey reflective stripes and a logo on the chest, laid out flat."
limousine (496).jpg,"A white Hummer stretch limousine is parked outside the entrance of a large, modern building with towering white columns during the daytime ."
quad (336).jpg,"A black ATV with knobby tires stands vertically against a light-colored wall with its wheels up, showing red lights illuminating its frame and the ground underneath, set against a background of a dark fence and greenery."
concrete_truck (383).jpg,A white Hyundai cement truck is parked in a lot with other vehicles.
uv (369).jpg,"Row of dark golf carts is parked along a curving brick pathway next to a small, ornamental building and a covered pavilion."
fallen_person (328).jpg,"An elderly man carefully helps an elderly woman, who is sitting on the floor with her walking stick nearby, to stand up in their living room."
motorbike (451).jpg,Two adult males stand next to a dark blue motorbike in an outdoor market filled with many other motorbikes during the daytime.
tractor (267).jpg,A red tractor with a white canopy drives down a paved road lined with trees and vegetation under a clear blue sky.
m3_ppe (152).jpg,Two workers in orange safety vests talk while one uses a walkie-talkie.
stealing_person (448).jpg,A person in a grey hoodie reaches into another person's backpack to steal a green wallet.
rv (116).jpg,An adult female pours yellow liquid from a yellow container into the engine of a white van during the daytime. 
convertible (425).jpg,"A sleek white convertible glides along a quiet coastal road under the bright afternoon sun, the vast blue sea stretching out beside it while rocky cliffs rise on the other side."
m5_ppe (80).jpg,"A man in his 30s, wearing a yellow helmet, transparent goggles, a checkered shirt, and a lime green safety vest with blue gloves, is carrying wood on his shoulder during the daytime."
m9_ppe (446).jpg,"A person wearing a white full-body protective suit, white shoes, a plastic face shield, a yellow mask, and glasses is standing outside a door."
train (244).jpg,A blue-and-green freight train hauls blue wagons through the station while people wait on the platform in daytime.
rickshaw (370).jpg,A black and white auto-rickshaw is parked on a roadside with utility poles and wires visible in the background during the daytime.
taxi (127).jpg,"An orange, white, and red taxi stands on the road under clear daytime weather with no visible brand or license plate, while two adult men are nearby."
fire (26).png,A large fire engulfs a building with palm trees in the foreground during the night time.
m5_ppe (331).jpg,A woman in her 20s or 30s with a brown headscarf and a black mask is looking straight ahead while giving a thumbs-up with one hand.
van (454).png,"In a black-and-white nighttime street scene, a pale van with its headlights and rear lights lit is parked beside the brick villas, and a man reaches for the handle of the van’s rear door. A BMW in white paint is parked at its side."
fallen_person (12).jpg,"A construction worker wearing a reflective vest and work boots lies unconscious on a tiled floor near a fallen yellow helmet, gloves, and scattered tools, indicating a workplace accident."
uv (376).jpg,Long white electric shuttle with tan seats is parked on an asphalt path next to a grassy area under a cloudless blue sky.
m6_ppe (9).jpg,"A middle-aged man wearing a yellow safety helmet, red ear protection, and a face shield over a blue vest stares straight ahead."
m9_ppe (70).jpg,"On a cloudy day, four men wearing safety helmets, yellow work vests, and safety lines are standing on the edge beside a domed roof."
rickshaw (307).jpg,"An adult male pulls a blue and brown rickshaw along a wide promenade beside the ocean, with city buildings and palm trees in the background during the daytime."
bird (152).jpg,A red flamingo is bending its head to look to the right in shallow water during the daytime.
train (316).jpg,A short white passenger train with people riding inside moves along the tracks in daytime.
traffic_accident (187).jpg,"During the day, a white car overturned on the road, several cars in the back, trees and a building."
car (191).png,"At night, a white SUV travels along the residential street, passing parked cars while three adults stand near a white compact vehicle up the hill."
police_car (164).jpg,A white and blue police car is parked in a parking lot.
suv (286).jpg,"A white Kia truck is parked on the street alongside other vehicles, with buildings and vegetation lining the road during daytime."
traffic_accident (344).jpg,"A silver car collides with a red car on a highway, raising dust in daytime."
fuel_truck (333).jpg,A red and white fuel truck with a long white tanker is driving on an elevated highway over a dense green forest under a partly cloudy sky during the daytime.
fallen_person (169).jpg,"A person is captured mid-fall, lying backward in the snow with their arms raised, showing the textured soles of their shoes on the snowy ground."
smoke (411).jpg,"A large amount of dark smoke billows into the sky over a mountainous landscape during the daytime, obscuring the horizon near a telecommunications tower."
m9_ppe (287).jpg,"A man wearing light blue gloves, light blue shoe covers, a white mask, safety goggles, and a white full-body protective suit is standing while facing forward."
license_plate (491).jpg,A white SsangYong Tivoli is parked beside a busy campus road during daytime displaying a blue license plate with 169허 1161 as pedestrians and vehicles move along the street.
m1_ppe (433).jpg,A worker wearing a yellow safety helmet and blue work suit is getting off the lift with a paint can.
dog (29).jpg,A dog is standing in front of a door.
fallen_person (370).jpg,"An older woman is lying on the living room floor, clutching her chest with a pained expression, with her glasses and a walking stick nearby."
license_plate (436).jpg,A black BMW sedan is parked along a campus roadside during daytime displaying a white license plate with 153하 1700 and a long line of cars and a high retaining wall extend behind it.
convertible (183).jpg,"A sleek dark-purple convertible sits under soft studio lighting, its glossy body reflecting the light while the open cabin reveals brown leather seats and sharp, futuristic tail lights stretching vertically along the rear"
convertible (438).jpg,"A dark-colored convertible approaches along a winding sunlit road through low, scrubby hills, its sleek front reflecting the soft afternoon light while the driver sits relaxed behind the wheel, framed by open sky and long shadows stretching across the smooth pavement."
bus (200).jpg,A golden Eicher bus from 'SHEETAL' travels on a city highway with large apartment buildings in the background.
m2_ppe (294).jpg,"A group of people, some wearing red and white helmets, are walking across a concrete rooftop."
police_car (14).jpg,A white Hyundai Tucson police car drives on a city street during the daytime.  
fire (107).png,Two adult male firefighters stand near a large fire during night time.
m9_ppe (175).jpg,"The front and back views of a person wearing dark brown sneakers, a light blue mask, and a white full-body protective suit with both hands on the waist are shown side by side."
bird (301).jpg,A gray pigeon stands on a metal bar looking to the left during the daytime.
dog (360).jpg,A woman is sitting on a bench with her cat.
dog (496).jpg,A man is kneeling down with a dog in his lap.
taxi (224).jpg,An orange taxi stops at the edge of the road under very cloudy weather.
pickpocketing_person (427).jpg,"In daytime outdoors, a black-hooded adult steals a phone from a woman wearing a gray coat."
taxi (20).jpg,A dark orange SUV taxi with pink-wrapped doors stands on the road during daytime under slightly cloudy weather with no visible brand or license plate.
bus (129).jpg,"A gray Volvo coach bus from 'HANIF', featuring a large black floral graphic, is parked in a garage with its teal window curtains drawn."
rv (326).jpg,A white camper van rests on the side of a paved road that stretches through a vast landscape. 
ambulance (82).jpg,"A medium ambulance is parked, no markings visible, no people around."
suitcase (302).jpg,People dressed in black are getting into the car.
van (272).jpg,"On a grassy field with dense trees, a sky-blue van decorated with yellow curves, flower graphics, and the word “HEMYSTERYMACHINE” is parked showing its side, while a blonde woman in a blue sleeveless top and green shorts stands smiling near the rear of the van."
holdingGun_person (201).jpg,"At night, an adult man in a black hooded zip-up, jeans and black glasses stands with a gun in his right hand, looking to his right."
suitcase (190).jpg,A man and a woman are looking at the dispatch schedule with a small intact suitcase placed beside them.
rickshaw (36).jpg,"Blue, green, and red Tuk-Tuks are parked in a row on a bright sunny day, with an adult and other people standing in the distant background."
suitcase (463).jpg,A carrier bag with a red pattern on a white background.
suv (322).png,"A white Kia SUV with license plate number 6319 travels down a city street at night alongside a bus and other vehicles, while a group of adults waits at a bus stop."
ship (429).jpeg,"A large white cruise ship with green-tinted windows sits docked at a port under a clear daytime sky, with several people standing on its upper deck."
jeep (51).jpg,"A lemon-colored jeep drives dusty ground during the day, stop other off-road vehicles, green steep foothills background."
motorbike (149).jpg,An adult woman sits on a white motorbike and poses in front of a large stone building during the daytime. 
traffic_accident (225).jpg,A white car is damaged against a guardrail on a road in daytime with multiple people in colorful clothing standing nearby.
tractor (496).jpg,"A red tractor with a front loader grips a round bale of straw, preparing to add it to a stack on a wooden trailer in a harvested field under a cloudy sky."
pickup_truck (284).jpg,"A white pickup truck is seen from behind on the left side of a wide road, where a sunset glow and shadows are cast."
tractor (251).jpg,"Several white tractors with large black tires and yellow rims drive down a road next to a green field under a clear blue sky, with a man on a motorcycle following behind."
fallen_person (207).jpg,"Several people are sitting and lying on a public sidewalk, surrounded by concrete bollards, with a street and buildings in the background."
walking_person (146).png,"A couple, the woman in a dark puffer jacket and pants carrying a bag and the man in a white puffer jacket and light pants, walks away down a narrow street at night."
ship (8).jpg,"A large beige pontoon boat rests near the shallow lakeshore on a sunny day as children wearing colorful life jackets splash and play in the water beside an adult sitting on the platform, while trees cast shade behind the boat and the open lake stretches into the distance."
holdingGun_person (479).jpg,"During the day, an adult man wearing a gray short-sleeved shirt, black shorts with 13 on it, and slippers is walking with a gun, an adult man wearing a green short-sleeved shirt and black shorts and white slippers is walking with a gun while looking at the gun, and an adult man wearing green sweatpants and black long pants and sandals is walking with a gun."
jeep (193).jpg,"A Toyota's sky blue Jeep with a white roof number plate N 1513 MB stops dusty ground, an adult male with a pink blanket drap over his shoulders stands near the driver's side, many other Jeep stops line up benhind, steep green mountains background during the daytime."
cat (119).jpg,"Two cats sit inside a cardboard box, with a cream-and-white cat looking upward calmly beside a black-and-white long-haired cat opening its mouth wide."
rickshaw (202).jpg,A monochrome Bajaj auto-rickshaw with license plate KL 52 AC 2717 is parked on a street in front of commercial buildings during the daytime.
m11_ppe (308).jpg,"An adult female construction worker smiles, wearing a yellow hard hat, clear safety glasses, a gray beanie, a red scarf, an orange hi-vis vest over a brown jacket, and gray and orange work gloves, with her gloved hands pressed together under a bright daytime sky."
m10_ppe (77).jpg,"An adult male kneels while bending down, exposing his lower back, wearing a yellow hard hat."
bird (194).jpg,"A gray pigeon stands in the shade below a building, bending its head down to look at food in front of it during the daytime, and another one walks to the left on the right side behind it."
truck (346).jpg,A blue small cargo truck with a silver metal box body is parked in a lot during daytime near a large red-and-gray building.
rv (128).jpg,An adult male sits in a wheelchair inside a dark grey van during the daytime. 
m11_ppe (337).jpg,"Three adult workers wearing safety helmets one woman in an orange reflective jacket and two men in suits and red-blue workwear stand outdoors during the daytime, reviewing a clipboard and discussing work"
bicycle (399).png,A street with a yellow line and a brick wall with a sign on it.
m1_ppe (18).jpg,A worker wearing a safety helmet and mask removes the hook of the harness and a passerby is watching the process.
police_car (169).jpg,A police car is parked in front of a restaurant.
m2_ppe (99).jpg,"Two men wearing helmets and safety harnesses talk to a supervisor with a clipboard, outdoor."
recycling_truck (179).jpg,Two men in orange work clothes are standing next to a large orange trash truck.
limousine (116).jpg,A smiling adult male in a black suit stands in front of a white stretch limousine that is parked on a shaded road surrounded by trees during the daytime .
m8_ppe (10).jpg,"Indoors at night, a young adult wearing a clear mask looks at the camera."
road_roller (128).jpg,"A well-maintained yellow LiuGong tamping foot road roller with an enclosed cab, used for compacting earthworks, operates on a newly graded roadbed during the day, with a grader and two other rollers visible in the background."
dog (31).jpg,A man is sitting on a couch with a dog.
m1_ppe (386).jpg,"A worker wearing a yellow safety helmet and gas mask is wearing a harness, turning his back to the right and looking at it at an angle."
fallen_person (406).jpg,A person in dark pants and a light shirt is lying curled up on a leaf-strewn sidewalk next to a fallen blue bicycle.
