filename,caption
van (271).jpg,"Inside a firetruck-themed ride-on car, a child wearing a dark brown beanie and a navy T-shirt sits holding the steering wheel, with ambulance and firetruck illustrations displayed on the back interior wall."
holdingGun_person (331).jpg,An adult man wearing a black mask and a black hoodie is driver-picking the door of a gray car.
bird (55).jpg,A white hen stands under a bench during the daytime.
recycling_truck (308).jpg,A garbage truck is parked on the street with a blue sign on the side.
recycling_truck (138).jpg,A white garbage truck is driving down a street with a black car in front of it.
m3_ppe (230).jpg,Three engineers in safety vests review documents together at a construction site.
convertible (419).jpg,"A group of friends rides through the countryside in a dark green convertible at sunset, their hair whipping in the wind as they stand and lean out of the car, laughing and reaching toward the warm golden light spilling across the open road."
sitting_person (180).jpg,A woman wearing glasses and a brown sweater sits on a black office chair on a carpeted floor with a striped pattern.
crane_truck (268).jpg,A grey Fuso truck equipped with an orange crane arm stands parked on a paved road during the daytime.
m2_ppe (71).jpg,People with white helmets and others without helmets are discussing inside a partially built room.
sitting_person (413).jpg,"A man in a white shirt, black tie, black pants, and glasses sits with his chin resting on his hand, looking thoughtfully to the side while seated on a white folding chair against a white background."
smoke (15).jpg,A large amount of dark smoke billows from a building on a sunny daytime with a blue sky overhead.
recycling_truck (443).jpg,A blue truck with a Thai license plate is parked on a gravel road.
fallen_person (447).jpg,"During a volleyball match, a player in black and red lies on the court after a play, while teammates and opponents watch the ball suspended in the air near the net."
truck (495).jpg,A white traffic-police truck carrying several people and their motorcycles moves through a flooded street.
rv (161).jpg,An adult female unloads camping chairs from a grey camper van during the daytime. 
bicycle (336).jpg,A blue car with a white roof is driving down the street with three bicycles strapped to the top of it.
truck (239).jpg,A small blue truck is heavily loaded with furniture and cushions stacked high in its cargo bed on a roadside.
fallen_person (432).jpg,"A snowboarder in dark gear and a helmet is falling backward on a snowy slope, with their board pointing skyward and snow spraying, near a ""Paralympic Games"" banner."
fire_truck (354).jpg,A red L1 fire truck labeled MT.PENN FIRE with a mechanical ladder on top drives on the road during daytime.
m5_ppe (483).jpg,A person is holding both hands out with their palms facing forward.
fire_truck (308).jpg,A red E4 fire truck drives on a narrow road during daytime with sedans parked on the right side.
traffic_accident (106).jpg,"Two vehicles collided on the road during the day, with one vehicle on the left and a building on the right. "
pickpocketing_person (225).jpg,A young woman in a black leather jacket and tan pants raises her arm on a daytime city street while another person reaches toward her backpack.
sports_car (211).jpg,"A bright yellow Lotus sports car parks neatly in a marked asphalt parking space, positioned against concrete wheel stops, beneath a clear daytime sky with green trees and a building visible in the background."
bulldozer (292).jpg,"During the day, a yellow bulldozer is pouring dirt on a pile of dirt."
pickup_truck (448).jpg,"Dull-colored buildings with large signs reading ""Pizza"" and ""McDonald's"" line both sides of a street where numerous overhead wires cross above, leading to a large white building with a green stripe at the end, while on the road, flanked by parked cars, a yellow pickup truck seen from behind, a motorcyclist in a white helmet and colorful top, and a pedestrian are visible."
excavator (84).jpg,"An orange Doosan excavator is on dirt ground with a wall and a hill with a building on it behind it, all under an overcast daytime sky."
pickup_truck (69).jpg,"A silver pickup truck with a white license plate is angled to the right, parked next to a white building's black door that has a silver metal frame."
fallen_person (55).jpg,"A worker wearing a yellow hard hat and blue overalls is lying on their back on the floor of a warehouse, with several cardboard boxes scattered nearby."
train (100).jpg,A black steam train with red buffers is on the tracks while people stand on a nearby double-decker bus.
convertible (412).jpg,"A bright red vintage convertible glides down a narrow, tree-lined road, its chrome accents catching flashes of sunlight as the lush green forest blurs around it, while the passenger lifts an arm joyfully into the warm air."
stealing_person (431).jpg,A woman clutches her purse tightly with a fearful expression as a person in a dark hoodie approaches her on a dimly lit city street at night.
truck (249).jpg,A black covered cargo truck is parked along a roadside lined with palm trees and vegetation.
crane_truck (456).jpg,A blue truck equipped with a red Unic crane is parked on a paved surface during the daytime.
m6_ppe (140).jpg,A man wearing a red safety helmet and a teal and gray mask stares straight ahead.  
pickup_truck (393).jpg,"In a high-angle view looking down at an intersection, the rear views of a white square box truck and a man cycling in a dark teal top with a black bag featuring white lines are visible in the right lane of the lower road, while white and black pickup trucks, SUVs, and sedans are parked in a line facing away on the right side, black and white sedans face forward in the left lane, and a black pickup truck moves along the road to the right showing its left side profile."
helicopter (53).jpg,"A small black helicopter with two-leaf propellers, tailrotters and skid landing gear flies over a lake with clear skies and forests."
bird (455).jpg,Two mandarin ducks stand on a thick tree branch in a tree during the daytime.
car (91).png,"At night, one white compact car and one sedan are parked on the roadside, and two people wearing hats with their hands in their pockets are walking down the alley."
fuel_truck (474).jpg,A white fuel truck with a red stripe on its tanker is parked next to the nose of a large passenger jet on a brightly lit tarmac during the night.
bulldozer (37).jpg,"During the day, a yellow CAT brand bulldozer is filling a dirt pile with dirt."
rickshaw (135).jpg,"A bustling street scene at sunset features a yellow and black auto-rickshaw, marked with 'नगरीय सेवा' and license plate R-119 P7138, alongside an adult male riding a scooter and an adult female walking."
walking_person (64).png,"A cyclist wearing a black top, red helmet, and mask rides down the path while a man in a purple shirt and red shorts walks uphill pushing his bicycle during the day."
smoke (159).jpg,A car drives past a large amount of smoke billowing from a wildfire in a wooded area during daytime.
bulldozer (280).jpg,This is the back of a yellow bulldozer during the day.
m9_ppe (55).jpg,"A man wearing a white safety helmet, noise-canceling headset, and a yellow fluorescent outfit combined with navy is walking along the middle of a path inside a factory."
fire (142).png,"A large fire rages on a hillside as an aircraft drops retardant, indicating a daytime operation."
m5_ppe (162).jpg,Yellow work gloves have a black coating on the palm.
crane_truck (177).jpg,A blue Thaco Ollin truck equipped with a red crane arm stands parked near a grey shipping container during the daytime.
dog (95).jpg,A man and his dog is playing in the yard.
suitcase (223).jpg,A woman in her 20s is standing inside a building holding a large suitcase in her hand.
car (116).png,"At night, a young adult man walks downhill while checking his phone and putting his hand into pocket near the parked white BMW sedan."
uv (337).jpg,"Group of people rides inside a long, open-sided electric shuttle through a dense tropical landscape."
uv (98).jpg,"A UV car is parked on the paved road in front of the grassy area, with wooden poles loaded on the back. "
rv (299).jpg,A young man wearing sunglasses smiles while looking at his phone and holding a camera in front of a white RV. 
m8_ppe (297).jpg,"Young adults wear white masks and gloves, one adjusting gloves while others use tools at computers during day."
cat (135).jpg,"An orange tabby cat sits on a counter and leans toward a white water fountain, drinking from the flowing stream in a warmly lit room."
forklift (10).jpg,A blue semi-truck with a flatbed trailer carries pallets of wrapped bricks in an industrial yard during the daytime. 
m8_ppe (116).jpg,A person wears a bright yellow vest and stands behind the camera during the day.
sports_car (269).jpg,A bright yellow Lamborghini sports car coupe gleams on an elevated display platform inside a bustling indoor space where several people observe the car and browse nearby exhibits under modern artificial lights.
fuel_truck (206).jpg,"A yellow and black refueling truck is positioned under the wing of a passenger jet, with a worker on a platform attending to the massive engine intake during the daytime."
tractor (360).jpg,"A blue New Holland tractor with large rear tires and white rims drives through shallow muddy water, with two cows grazing in the background and a bucket on the right."
m8_ppe (402).jpg,"A young woman stands indoors wearing a clear shield with black band, looking forward during the day."
m4_ppe (338).jpg,A man is wearing yellow vest.
fire_truck (70).jpg,A fire truck with a mix of red and white colors labeled E42-1 stands on the road in daylight.
m7_ppe (487).jpg,"A man wearing a white hard hat and an orange safety vest stands between railroad tracks and speaks, with a yellow construction vehicle in the background."
quad (21).jpg,"A laughing young couple rides a white all-terrain vehicle with its headlights blazing along a sandy beach at sunset, with yachts and distant mountains visible in the background."
truck (308).jpg,Two uniformed officers conduct a roadside inspection with the driver of a small blue flatbed truck while another blue enforcement vehicle is parked behind them.
uv (427).jpg,Tan golf cart with a golf bag on a pushcart is parked on a dirt path next to a wooden barrier and a green course.
concrete_truck (193).jpg,A large yellow truck with a black box on the back of it.
bicycle (115).jpg,A man wearing a helmet and riding a bicycle on a dirt road.
motorbike (346).png,An adult male wearing a white helmet is stopped on a delivery motorbike next to a taxi on a city street at nighttime.
m7_ppe (313).jpg,A smiling woman with long brown hair looks directly at the camera while adjusting her clear face shield.
concrete_truck (128).jpg,A large orange truck with a black cab and a yellow trailer.
fire (92).png,Two adult males stand near a large fire engulfing a structure at night.
m3_ppe (80).jpg,"Two engineers, a man and a woman, walk through a concrete building under construction while the man points ahead."
car (454).png,"During the day, a black sedan is parked in front of a store with a yellow pedestrian crossing, while a black scooter with a red delivery box waits nearby."
rickshaw (19).jpg,"A bustling urban street lined with multi-story buildings and illuminated signs is packed with adult pedestrians and a dense mix of red cars, red and blue tuk-tuks in heavy traffic during the late afternoon."
rickshaw (493).jpg,A grey auto-rickshaw with license plate KA01 M9996 is parked on a road with trees and an overcast sky in the background during the daytime.
car (462).png,"At night, more cars including a white mini truck and a black van approach the intersection, while the black sedan waits under the streetlights."
fire (313).png,Several adult male firefighters observe a large forest fire during the daytime.
quad (152).jpg,"A man and a young boy, both wearing helmets, speed along a dirt track on a red all-terrain vehicle amidst a background of lush green forest trees during the daytime."
m8_ppe (378).jpg,"A mannequin shows a clear face shield with blue headband, age, actions, and daytime unknown."
police_car (70).jpg,"Several adult male police officers are conducting a sobriety checkpoint on a road during the daytime, with a white Hyundai Sonata police car parked nearby."
ship (361).jpeg,A sleek white racing sailboat with a tall two-toned mainsail and several people working on deck glides rightward across vivid turquoise water near a rocky shoreline and parked cars under clear sunny skies.
m3_ppe (167).jpg,Two female workers wearing safety vests and hard hats discussing inside a warehouse.
tractor (485).jpg,"A green tractor with large red-rimmed wheels pulls a red planter through a freshly tilled field, leaving behind a trail of disturbed soil under a cloudy sky."
stealing_person (207).jpg,A worker in a lime green shirt and white hard hat cleans graffiti from a metal pole next to a yellow and red diamond-shaped sign on a roadside.
taxi (34).jpg,A light-yellow Toyota SUV with white and graphic-wrapped sides stands under mostly cloudy daytime weather with the visible license plate TAH-303.
m2_ppe (289).jpg,"A person wearing a red helmet and glasses is sitting at a desk, talking on a landline phone inside an office or control room."
motorbike (179).jpg,An adult woman sits on a blue motorbike and poses in front of a mountain landscape during the daytime.
m1_ppe (77).jpg,"Six workers wearing yellow helmets, blue work clothes, and white harnesses are under construction."
m5_ppe (65).jpg,"A man in his 20s or 30s, wearing a white earmuffs, a red face shield helmet, and a brown polo shirt, is smiling at the camera during the daytime."
pickup_truck (120).jpg,"A bright silver Toyota pickup truck with a red-rimmed white license plate stands facing to the right on a bronze floor inside a building, with a two-seater teal pickup truck next to it."
tractor (81).jpg,"A man drives a white and red Eicher tractor with large, muddy tires through a waterlogged field, with other tractors and people visible in the background."
helicopter (313).jpg,"Two white US Navy medium-sized helicopters, each with a four-blade propeller, a four-blade tail rotor, one large wheel on each side in front and a pair of smaller wheels in the center at the back, fly side by side over the sea with a city in view."
quad (385).jpg,"A red, black, and white racing ATV stands on green artificial grass in front of a white shipping container during the daytime."
fire_truck (90).jpg,A red fire truck marked ARFD drives in daylight behind a white truck.
concrete_truck (96).jpg,A large yellow cement truck is parked on a dirt road at night.
m7_ppe (454).jpg,"A sideways, blurry view shows a man in a safety vest putting on a blue hard hat."
suitcase (492).jpg,Carriers are placed in the baggage center.
helicopter (43).jpg,"A small helicopter with two-leaf propellers, tailrotters and skid landing gear, white at the front and blue at the back, flies over a cloudy sky with its doors open."
m1_ppe (315).jpg,A fat worker in a harness turns around in front of a white sofa looking at the template.
m8_ppe (223).jpg,"Adults set up indoor barricades without visible PPE, time unclear."
m6_ppe (75).jpg,"An adult man wearing a white safety helmet, black sunglasses, and a yellow safety harness stands with one leg forward during the day."
van (417).png,"In a lamp-lit monochrome night, the door of the nearest brick villa has trash bags placed outside, and a HYUNDAI van with a white plate drives with both headlights on while a white BMW is parked along the opposite side."
taxi (279).jpg,A silver sedan taxi and an orange sedan taxi occupy the road with no visible brand or license plate under rainy nighttime conditions.
airplane (462).jpg,"A blue and white Embraer 190 regional jet, featuring the white text 'KLM cityhopper' on the blue upper fuselage, the registration 'EZ...322' near the nose gear, and a white 'KLM' logo visible on the engine cowling and winglet, climbs against a clear, deep blue sky."
crane_truck (408).jpg,A white Hyundai HD320 truck equipped with a yellow crane structure sits during the daytime.
convertible (179).jpg,"A dark green convertible car with a light interior is parked near a beach, captured from a front-left angle with waves rolling onto the sand in the background and soft sunlight reflecting off its glossy surface."
airplane (296).jpg,"A white Alaska jetliner, featuring ""Alaska"" in dark stylized script on its side, the registration ""N316AS"" on the rear fuselage, and a prominent Eskimo portrait on its tail, rests on a grey tarmac, with a ground worker in a red vest standing to the right, a line of orange cones in the foreground, and the green tail of a ""Song"" aircraft and hazy mountains in the background."
holdingGun_person (20).jpg,"An adult man dressed in black, wearing a black hood and a black mask, is standing indoors. He is holding a handgun in his right hand, aiming it, and holding a bundle of cash in his left hand, with both arms raised at right angles."
m10_ppe (325).jpg,"An adult worker, wearing grey knit gloves and an orange full-body safety harness, grips a yellow handrail and a white rope during daytime."
taxi (313).jpg,A yellow SUV taxi appears in clear daytime with no visible brand or license plate.
excavator (421).jpg,"A yellow excavator operates on a dirt ground with a small yellow bulldozer to its right and another yellow bulldozer below, all under the daylight sky."
road_roller (331).jpg,"A used yellow Volvo tamping foot road roller with a sturdy build, designed for compacting cohesive soils, is actively working on a dirt field during the day, operated by an adult male in a light-colored shirt and shorts."
m11_ppe (330).jpg,"Four adult males in orange coveralls and caps, with two wearing turquoise gloves and one wearing safety glasses, actively work on a large yellow and gray machinery component using a wrench in a daytime."
stealing_person (6).jpg,Two individuals wearing black gloves use crowbars to pry open a door frame against a blue background.
m9_ppe (264).jpg,"The front and back views of a person wearing light blue shoe covers, a light blue mask, and a white full-body protective suit with a hand on the waist are shown side by side."
stealing_person (468).jpg,A person wearing a black mask types on a laptop while sitting in the driver's seat of a car.
truck (405).jpg,A row of small blue Hyundai cargo trucks with black tarp-covered metal cargo bodies is lined up in front of a Hyundai building during daytime.
fighting_person (431).jpg,"During the daytime, an adult man wearing a white top lies on top of another adult man wearing a black top who is lying on the ground while they fight."
concrete_truck (192).jpg,A large yellow cylinder is sitting on a dirt ground.
m7_ppe (171).jpg,A person's hands unfold an orange safety vest with grey reflective stripes over a grey table with text below.
cat (351).jpg,"A small grey tabby kitten with a pink collar drinks water from a wide, shallow pink bowl on a white surface."
convertible (328).jpg,"A sleek, deep-olive convertible sits poised on a clean stone courtyard, its sculpted surfaces reflecting the pale light of the modern glass building behind it while the warm tan interior glows invitingly in the open air, the sharp chrome accents and fluid curves giving the car a calm yet confident presence amid the geometric architecture."
train (139).jpg,A white-and-black high-speed train waits at the platform while people board and roll suitcases in the evening.
smoke (4).jpg,"Two adult firefighters spray water on a large blaze amidst thick smoke emanating from a pile of logs in a forest at night, while a yellow front-end loader operates nearby."
fallen_person (347).jpg,"A woman with long brown hair is lying on an asphalt path, supporting herself with her hands, possibly after a fall or while attempting to get up, next to a curb."
rickshaw (438).jpg,Two dark-toned auto-rickshaws travel along a divided road flanked by vegetation during the daytime.
walking_person (311).png,"A man dressed in a black jacket, shorts, and a blue cap walks along a paved park path at night while looking at his smartphone."
bus (484).jpg,"A white 'SHYAMOLI PARIBAHAN' Scania coach bus, featuring tan, black, red, and blue stripes on its rear, is parked in a wet lot during the daytime."
rv (492).jpg,A young woman with a prosthetic leg and a young man walk side-by-side on a dirt path in a forest during the daytime with a small dog between them. 
van (144).jpg,"A white van with two orange emergency lights, a black license plate reading “WQW 2961,” and a front logo that reads “UEM” is passing through the “M04” tollgate, while a black sedan is seen driving in the adjacent lane. "
forklift (91).jpg,"An adult male stands on a dark flatbed truck laden with cardboard bales as another adult male points near a white delivery truck and a yellow grapple loader, while a third adult male operates an orange GENC forklift carrying waste in a wet industrial yard during the daytime. "
m7_ppe (384).jpg,A large yellow industrial bin is being lifted by a strap while a worker in a hard hat and safety gear stands on a platform nearby.
pickpocketing_person (356).jpg,"In daylight, a black-shirted youth reaches into the backpack of another in a white jacket with black backpack."
excavator (192).jpg,"A yellow excavator is on dirt ground with a river to its right, a road to its left, a bridge behind it, and a building to the rear right, all under a partly cloudy daytime sky."
train (369).jpg,An orange diesel freight locomotive has workers standing on its side steps in daytime.
dog (226).jpg,A little girl is playing with her dog in a field.
tractor (27).jpg,"A rusty red tractor with large rear wheels and a metal plow attachment rests near a large tree, while a brown trailer with laundry hanging on it sits to its left, and a brick building stands in the background."
convertible (84).jpg,"That’s a Bentley Continental GTC — smooth silver grace stretched under California palms, the kind of car that whispers wealth instead of shouting it."
forklift (13).jpg,"A red and black forklift with a light gray clamp attachment, model CPCD20, stands on pavement in an outdoor yard with buildings and trees during the daytime. "
holdingGun_person (231).jpg,An adult man wearing a blue mask and a blue short sleeve shirt stands indoors with his gun facing the front and his right hand facing the gun down.
rickshaw (394).jpg,"Two monochrome auto-rickshaws, featuring light and dark gray panels, are parked side by side on a paved surface beside a road during the daytime."
ambulance (341).jpg,A medium ambulance has no readable red plate and no people are visible.
traffic_accident (107).jpg,"One vehicle and another collided into the front, with debris visible in front, many trees behind, and a truck on the right during the day."
rickshaw (212).jpg,"A black auto-rickshaw displaying license plate KA.04 AA.2801 idles on a busy city street, surrounded by an adult male motorcyclist and various pedestrians during the daytime."
m11_ppe (55).jpg,"An adult female wears black earmuffs, clear protective safety glasses, and a light blue denim shirt while repairing wooden furniture with a power drill indoors."
limousine (249).jpg,A long black Lincoln Town Car stretch limousine is parked on a paved driveway in front of a residential garage during the daytime .
smoke (259).jpg,A large amount of smoke billows from a distant fire on a sunny daytime as an airplane flies in the sky.
concrete_truck (226).jpg,A man in a yellow shirt is pouring concrete into a bucket.
license_plate (92).jpg,A silver vehicle displays a green license plate 02너 1492 during daytime.
van (2).jpg,"In the daytime, two men in work clothes are handling tools beside a van with the words ""SUPERFAST FIBRE BROADBAND"" written on its white body."
taxi (48).jpg,"Four yellow SUVs appear on the road, with two parked on the roadside and two on the road; the two on the road are Toyota vehicles with the visible license plates TDG7791 and TDB0658, while the two on the roadside have no visible brands or license plates, under clear daytime weather."
sitting_person (26).jpg,A young woman with curly brown hair rests her head on her hand while looking down at a white laptop on a brown couch.
airplane (40).jpg,"A large, twin-tailed airplane with a grey and white camouflage pattern, the number ""3709"" on its side, and a pilot in the cockpit, flies at high speed with orange flames coming from its engines during the daytime, trailing black smoke over a field with a crowd of spectators."
concrete_truck (367).jpg,A white Hyundai cement truck with a large cement mixer on the back.
m11_ppe (107).jpg,"Three adult construction workers — an adult woman in front holding blue folders with red earmuffs around her neck, an adult man in the middle holding a rolled-up blueprint, and another adult man in the back holding a black clipboard — all wear yellow hard hats, orange reflective safety vests, yellow safety glasses, and white masks while standing together at a construction site in daytime."
concrete_truck (458).jpg,A white truck with a cement mixer on the back is parked in a driveway.
uv (53).jpg,"An elderly man is driving a golf cart with one hand resting on the shoulder of another elderly man sitting beside him, and they are both smiling. "
pickpocketing_person (96).jpg,"Two adults, one in jeans and a light T-shirt and the other in a dark jacket sleeve, with the latter removing a phone from the former’s back pocket in daylight."
suv (354).png,"A white Range Rover SUV and a grey sedan are stopped at a busy intersection with pedestrian crossings at nighttime, as banners with Korean text hang overhead."
