filename,caption
crane_truck (106).jpg,A yellow crawler crane sits on a long red and green barge floating on the water under a blue sky during the daytime.
crane_truck (370).jpg,A white Hino 500 truck featuring a yellow Soosan crane arm stands parked on a dirt surface in front of a building during the daytime.
helicopter (465).jpg,"A large black helicopter with a tandem rotor configuration with three propellers in series in the front and back, a pair of large wheels on each side in front and a small wheel on each side in the back is flying over the cloudy sky."
limousine (410).jpg,"A large white Ford Excursion stretch limousine is parked in a mostly empty lot with palm trees and a ""STOP"" sign visible during the daytime."
convertible (116).jpg,"A silver convertible car is parked on a sunlit asphalt lot beside a building, with other vehicles and a blue-and-yellow wall in the background."
helicopter (164).jpg,"A small orange helicopter with two-leaf propellers, tailors and skid landing gear has two people on board and flies over a river-flowing forest."
stealing_person (54).jpg,A man in a suit and tie discretely pockets a small item while looking over his shoulder in a store.
taxi (424).png,A white SUV taxi drives through the intersection at night with no visible brand or license plate.
m5_ppe (312).jpg,"A man in his 20s or 30s, wearing a black short-sleeved shirt, a yellow earmuffs, and yellow face protection gear, is looking to the side in the daytime."
m10_ppe (25).jpg,"An adult male, wearing an orange hard hat, dark goggles, an orange safety vest, and dark gloves, carries a blue-suited rescue dummy over his shoulder within an industrial facility during daytime."
walking_person (67).png,A man dressed in a purple shirt and red shorts pushes a black bicycle along a red paved path bordered by a wall and blue pillars during the day.
suitcase (131).jpg,A family is talking to a hotel staff member in front of a counter with very large suitcases placed beside them.
fire (321).png,A large fire consumes trees and grass in a smoky forest during daytime.
m10_ppe (8).jpg,"Six adults, each outfitted in an orange reflective vest and red helmet, stand in a row outdoors near a body of water during daytime, with one also wearing black goggles."
rickshaw (291).jpg,"A cycle-rickshaw, brightly adorned with pink, purple, and blue lights, carries an adult male driver and adult passengers along a road in front of the illuminated Houses of Parliament and Big Ben at night time."
helicopter (444).jpg,"A large black helicopter with a tandem rotor configuration with three propellers in series in the front and back, a pair of large wheels on each side in front and a small wheel on each side in the back, landed on a grassy field with many trees, and five vehicles were parked next to it."
sports_car (371).jpg,"Several racing cars, including a prominent blue and white one with the number 25, are parked indoors under bright lighting while people stand around them."
m1_ppe (55).jpg,"The oblique worker is rotating with his hands raised while wearing all protective gear such as safety helmets, sunglasses, masks, and harnesses. "
m7_ppe (61).jpg,"A person with long dark hair looks down while wearing an orange polo shirt, a grey zip-up hoodie, a lanyard, and a clear face shield."
fighting_person (383).jpg,An adult man wearing a white short-sleeve T-shirt swings his fist at another adult man wearing a red short-sleeve T-shirt while an adult man wearing a gray short-sleeve T-shirt and sunglasses grabs the clothing of the red-shirted man and pulls him during a fight. 
train (35).jpg,A large silver-and-teal train is at the station with nobody on the platform during daytime.
motorbike (368).jpg,A young woman sits on a black motorbike and poses on a paved road during the daytime.
m2_ppe (288).jpg,A group of workers wearing red and black helmets and blue work uniforms are walking inside a dimly lit industrial facility.
traffic_accident (15).jpg,A blue car is overturned near a guardrail with broken glass on the ground during daytime.
train (112).jpg,"A red-and-gray electric train sits in a depot with no people visible, time unclear."
m1_ppe (317).jpg,A worker wearing a white safety helmet holds the mask with his left hand while wearing protective gear.
fighting_person (336).jpg,"At night, an adult man wearing a brown shirt and blue pants stands while kicking toward the face of an adult man wearing black clothing and a black mask during a fight. "
crane_truck (35).jpg,A white reach stacker lifts a shipping container in a busy port filled with stacked containers during the daytime.
sports_car (55).jpg,"A red Lamborghini sports car with its doors open sits on a grassy field during the daytime, with people in the background and trees providing shade."
m4_ppe (289).jpg,An adult male is wearing a clear face shield.
sports_car (130).jpg,"A white Chevrolet Corvette GT racing car, bearing number 72 and ""Valeo"" branding, speeds around a racetrack turn during daytime, with a blue race car blurring in the background."
m2_ppe (311).jpg,"Three men, one wearing a red helmet, are walking together on a concrete rooftop."
dump_truck (451).jpg,A white dump truck unloads its contents onto a dirt pile at a construction site with yellow construction equipment in the background.
license_plate (369).jpg,"A black Genesis sedan is parked on a wet parking spot during daytime, displaying a white license plate with 311오 9467, with the building entrance and mailboxes visible behind it."
holdingGun_person (475).jpg,"During the day, an adult man in a gray short-sleeve shirt, black shorts with 13 on it, and slippers is walking with a gun, an adult man in a green short-sleeve shirt and black shorts is standing with a gun, an adult man in a green sweatpants jacket and black long pants and sandals is walking and an adult in purple pants is standing with a gun."
excavator (327).jpg,"A white and red Takeuchi excavator sits on a road with bricks behind it, a wall further behind that, and a traffic cone in the foreground."
m10_ppe (38).jpg,"Five adult individuals stand in a line during the daytime, wearing orange high-visibility vests with reflective stripes and red hard hats."
recycling_truck (91).jpg,A garbage truck is driving down a brick road in a small town.
bird (95).jpg,A white goose swims in the water during the daytime.
train (202).jpg,A long red passenger train moves along the tracks with no people visible in bright daytime.
bicycle (239).jpg,"Three men are riding bikes down a street, with one man wearing a helmet and smiling."
ambulance (237).jpg,"A medium ambulance van has plate 702916, no people visible."
m10_ppe (17).jpg,"An adult male performs a rescue carry with a blue-suited dummy, wearing an orange hard hat, an orange high-visibility vest, dark goggles, and black gloves, within an industrial setting during daytime.   "
helicopter (292).jpg,"A small helicopter with a black base and a single white stripe in the middle, with a three-blade propeller, a two-blade tail rotor, and skid landing gear, is flying in a cloudy, sunset sky."
suitcase (282).jpg,"A man is walking across a crosswalk in broad daylight, pulling a small black suitcase."
fuel_truck (105).jpg,A green and yellow fuel truck with the code 'C-125A' is parked next to a large white passenger airplane being serviced by multiple workers handling luggage carts near gate 6 during the daytime.
excavator (273).jpg,"A yellow excavator with its bucket raised high is on dirt ground with a wall behind it, mountains beyond the wall, and a clear daytime sky."
train (1).jpg,A long blue train moves past the platform in daytime with no people around.
suitcase (113).jpg,A woman in her 40s is sitting on a bench in front of a train with a very large suitcase placed in front of her.
m10_ppe (211).jpg,An adult male makes a surprised expression with a blue-gloved hand on his forehead while wearing a white hooded hazmat suit and a light blue surgical mask during the daytime.
bulldozer (350).jpg,"A yellow bulldozer, model WA380, is parked inside the building."
fire (7).png,A large fire engulfs a house nestled among trees during the daytime.
ship (304).jpeg,A massive white cruise ship glows with bright blue lights while docked at night beside a pier with several walking people.
m2_ppe (227).jpg,Several people wearing red and white helmets are examining construction blueprints under umbrellas on a rainy day.
holdingGun_person (45).jpg,"At night, inside a store, an adult man wearing a white jacket with the hood up, a yellow top, jeans, and sneakers is holding a gun and pointing it at a person wearing a striped shirt."
m2_ppe (2).jpg,An employee wearing a yellow and orange safety helmet is looking around the structure of the building.
fire_truck (419).jpg,A red fire truck is parked between red buildings during the day.
recycling_truck (276).jpg,"A man is unloading a truck filled with garbage bags, and the trash is being sorted into the back of the truck."
m7_ppe (340).jpg,A smiling woman with brown hair and glasses looks to her left while wearing a clear face shield attached to a thin blue frame.
cat (453).jpg,A black and white cat lies in a cage with sunlight shining on its fur.
bulldozer (97).jpg,There's a yellow bulldozer from SDLG on a white background
m6_ppe (193).jpg,"An adult man wearing a red safety helmet, a gray mask, and white work clothes stares straight ahead."
fallen_person (369).jpg,"Two warehouse workers in safety vests and hard hats attend to a third worker lying on the floor, possibly injured, in an aisle filled with stacked boxes."
stealing_person (18).jpg,A person wearing a camouflage baseball cap and a striped hoodie sprays graffiti onto a brick wall.
police_car (311).jpg,A white police car with a red light on top is parked on the street.
concrete_truck (154).jpg,A large yellow cement truck is parked on a dirt road.
m5_ppe (204).jpg,"A man in his 20s, wearing a blue checkered shirt and a yellow earmuffs, sits in a chair with his hands crossed on a desk in the daytime and smiles."
cat (106).jpg,"Three kittens, including a white one with blue eyes and a tabby-and-white one, lie on the floor under a piece of furniture with soft light illuminating them."
smoke (410).jpg,"A large amount of smoke billows into the sky from a distant wildfire under a clear daytime sky, with communication towers in the foreground."
m6_ppe (293).jpg,"A man wearing a white safety helmet, clear goggles, a white mask, a blue short-sleeved work uniform, and yellow gloves stands in a car repair shop with both arms raised beside his head, showing his palms."
m11_ppe (262).jpg,An adult male wearing a clear face shield and speaks into a black microphone.
cat (218).jpg,A striped cat stands on the floor and looks into a large black bowl filled with water.
forklift (127).jpg,An adult male drives a yellow Toyota forklift carrying two blue barrels on a pallet through an obstacle course of traffic cones during the daytime. 
limousine (153).jpg,Two white Lincoln stretch limousines are parked side-by-side on an asphalt road surrounded by trees during the daytime .
police_car (120).jpg,A white car is parked next to a blue and white police car.
ship (470).jpeg,A large white sailboat with fully raised black sails carries a group of sailors leaning over the side as it races through choppy ocean waves in daytime.
m3_ppe (444).jpg,A worker in a safety vest and helmet is communicating with a walkie-talkie at the port.
rv (17).jpg,A white SUV tows a white travel trailer on a paved driveway beside a brick house.
pickpocketing_person (442).jpg,"Time unclear, one adult steals a wallet from a brown leather purse outdoors."
sports_car (289).jpg,"A dark blue and polished metal replica sports car, featuring a black soft top, stands parked in an asphalt lot during the daytime, with green trees and other vehicles visible in the background."
truck (385).jpg,A white Daihatsu Hijet mini truck loaded with cut logs is parked on a forest trail surrounded by dense trees during daytime.
dump_truck (457).jpg,A white dump truck is tipping its bed to unload gravel onto a dirt road in a construction area under a cloudy sky.
dog (103).jpg,A man is walking a dog on a leash.
forklift (381).jpg,"An adult male operates a yellow and black CAT forklift, moving a large stack of cardboard boxes in a warehouse during the daytime. "
m9_ppe (358).jpg,"A person wearing black shoes, black gloves, a gas mask, and a white protective suit with a mark on the chest is standing facing forward with a hand on the waist."
suitcase (335).jpg,"People are gathered at a place marked ""International Arrivals"" and one person is walking with a medium-sized black suitcase."
sports_car (365).jpg,A light blue Mercedes-Benz coupe stands on a wooden floor at an indoor event where various people observe it under artificial lighting.
sports_car (39).jpg,A yellow Porsche convertible with a man driving speeds down a street during the daytime with buildings and trees in the background.
m7_ppe (378).jpg,"A line of construction workers, wearing safety vests over their uniforms, holds red hard hats at their sides in a grainy outdoor scene."
quad (288).jpg,"A man, wearing a red helmet and blue shirt, rides a blue All-Terrain Vehicle down a steep sand dune, kicking up a large cloud of brown sand against a clear blue daytime sky."
rickshaw (77).jpg,"A middle-aged man sits in a brown and tan auto-rickshaw featuring glowing blue interior lights on a dark street at night, with a brightly lit church spire visible behind a fence."
rickshaw (123).jpg,"A multi-colored auto-rickshaw with blue side panels featuring white wing decals travels quickly, carrying an adult male driver and an adult female passenger looking out, during the daytime."
traffic_accident (19).jpg,A white car is overturned on the roadside while a sheriff car is parked nearby during daytime.
bicycle (280).png,A man riding a bicycle on a street with a brick wall and a brick fence.
dump_truck (341).jpg,A yellow dump truck unloads dirt onto a sandy beach under a cloudy sky.
pickup_truck (268).jpg,"A silver-gray pickup truck is seen from behind on the left side of a wide road, its cargo bed enclosed by a metal fence and holding a person in a red shirt, a person in a purple shirt with a beige beanie, and a person in a green shirt."
suitcase (33).jpg,"During the day, a woman is walking wearing an intact bag on her left shoulder and holding a large intact suitcase in her right hand, while a man is walking holding an intact bag in his left hand and a large intact suitcase in his right hand."
m5_ppe (96).jpg,"A man in his 20s or 30s, wearing a yellow helmet, transparent goggles, a green checkered shirt, and a tool belt with many pockets, is holding a yellow level in his left hand and grabbing his yellow helmet with his right hand, all while wearing yellow gloves."
m4_ppe (375).jpg,A young woman is wearing a white face mask.
holdingGun_person (471).jpg,"During the day, an adult man wearing a gray short sleeve shirt, black shorts with 13 on him and slippers is walking with a gun, an adult man wearing a green short sleeve shirt and black shorts is walking with a gun looking at the floor, an adult man wearing a green sweatpants jacket and sandals wearing black long pants is walking with a gun, and an adult man wearing purple pants stands with a gun."
airplane (305).jpg,"A large white China Southern jetliner, featuring ""CHINA SOUTHERN"" and ""中国南方航空"" in blue lettering on its fuselage, the registration ""B-2051"" on the rear, and a red kapok flower logo on its blue tail, taxis along a grey runway past a field of dry brown grass, with a large white building in the background under a hazy sky."
limousine (215).jpg,A young adult male in a white shirt and black pants stands posing next to a long white Hummer stretch limousine on a brick paved driveway during the daytime .
m1_ppe (276).jpg,A worker wearing a silver safety helmet and sunglasses is wearing gloves and filming the front and back.
m6_ppe (223).jpg,"An older man and a middle-aged woman, both wearing a vest with red and yellow stripes, hold a potted plant in one hand, and the older man places one hand on the woman's shoulder."
recycling_truck (407).jpg,A group of people are standing on the sidewalk next to a garbage truck.
police_car (187).jpg,A row of police cars parked on the side of the road.
smoke (110).jpg,"During the daytime, a male adult stands on a grassy hill pointing towards a large amount of white smoke emanating from a vehicle on a paved path surrounded by trees and foliage."
van (410).png,"In the same black-and-white night setting, the back door of a white-toned van packed with delivery boxes stands open as a vested worker reaches in to retrieve one, with a white BMW parked at the worker’s side."
fallen_person (206).jpg,"Several people are sitting and lying on the ground next to concrete barriers on a busy street, with a large building visible in the background."
sports_car (349).jpg,A blue classic Ferrari sports car rests on a trailer next to an open ramp in a daytime setting with trees and buildings in the background.
motorbike (499).jpg,A blue motorbike stands parked tightly among other bikes in an indoor parking area.
m5_ppe (392).jpg,A person wearing a blue outfit and a blue face shield is working with a tool.
ambulance (445).jpg,A medium ambulance van is parked with unreadable plate; no one is visible.
m8_ppe (96).jpg,"A young adult wearing a neon yellow-green vest stands posing for a studio photo, time unknown."
rv (260).jpg,A white camper van parks on a brick surface at night. 
uv (3).jpg,"An elderly man with his cap is driving a golf car, and elderly woman is sitting beside him."
taxi (185).jpg,A white Hyundai sedan taxi is parked with license plate 36바 7307 at night.
ambulance (422).jpg,A medium ambulance van with plate 9981232 is parked; no people are visible.
sports_car (161).jpg,"A bright red convertible roadster, showcasing D3 branding on its hood, sits parked on a paved surface during the daytime as several individuals walk past a modern building in the background."
stealing_person (352).jpg,A woman in a fur coat uses her smartphone in an alley while a silhouetted figure stands in the background.
suv (486).jpg,A dark-colored Mazda SUV with license plate VGV 8793 is at a toll booth at night time.
fallen_person (61).jpg,"A construction worker in a yellow hard hat and red overalls sits on the floor of an unfinished building, clutching his knee in apparent pain, with tools and a ladder nearby."
bus (37).jpg,A weathered white Hino bus with a large red and white 'X' graphic is parked with its door closed on a dirt lot littered with rocks and debris under an overcast sky.
rv (203).jpg,A young woman performs a tree pose yoga as a light blue van sits with its doors open on a grassy dune during daytime. 
m3_ppe (402).jpg,Two workers in safety gear review plans together while looking at a laptop.
bird (226).jpg,"A bird flies in the shade below a building during the daytime, and another gray pigeon walks to the left."
bicycle (87).jpg,"A man and a woman are standing next to a bicycle, with the man holding a bike lock."
suitcase (426).jpg,"A large black carrier bag, a small beige carrier bag, and a small blue carrier bag."
cat (303).jpg,A small tabby kitten is drinking water from a blue bowl on a wooden deck.
m11_ppe (108).jpg,"Three adult construction workers — an adult woman in front holding blue folders with red earmuffs around her neck, an adult man in the middle holding a rolled-up blueprint, and another adult man in the back holding a black clipboard — all wear yellow hard hats, orange reflective safety vests, yellow safety glasses, and white masks while standing together at a construction site in daytime."
tractor (134).jpg,"A white and red Eicher tractor is stuck in thick mud with its front wheels partially submerged, while other tractors, including a green John Deere and a red tractor, are visible in the background."
m7_ppe (426).jpg,"A vertically oriented, sideways view captures a man holding a safety vest while standing by a car with its hood up."
m9_ppe (235).jpg,"A person wearing light blue shoe covers, a light blue mask, and a white full-body protective suit is standing."
rv (270).jpg,A white RV with solar panels on its roof sits on a dirt road. 
suitcase (392).jpg,A large pink carrier and a small white carrier.
truck (320).jpg,"Four small Suzuki Carry trucks are parked in a row during daytime, with three white trucks on the left and a single blue truck positioned on the right."
m11_ppe (282).jpg,A young male wears a clear face shield incorporating clear glasses with blue temples while looking to the side with slightly smiles.
dump_truck (176).jpg,Multiple yellow excavators and dump trucks operate in a large open-pit mine with mountainous terrain in the background.
crane_truck (57).jpg,A weathered crawler crane on a barge uses a clamshell bucket to transfer material from a blue boat during the daytime.
cat (197).jpg,A small cat with mixed white and tabby fur is leaning against a large metal container and drinking water.
m2_ppe (162).jpg,Workers in blue uniforms and blue helmets pulling ropes to install equipment on an electric pole in a field.
convertible (456).jpg,"A row of stripped, weather-beaten cars sits abandoned along a quiet street, the nearest one a faded turquoise convertible with peeling paint and missing parts, its rusted body slumped on uneven pavement while overgrown trees and worn buildings behind it add to the scene’s sense of long-forgotten decay."
car (29).jpg,"At dusk, a white Hyundai sedan is driving past a coffee shop on a quiet street, its headlights slightly illuminating the road."
recycling_truck (163).jpg,A man in an orange shirt is emptying a green trash truck.
forklift (6).jpg,"A blue truck, loaded with bricks, is parked next to neatly stacked pallets of bricks, as a yellow forklift stands near a conveyor belt at an outdoor industrial facility during the daytime. "
truck (210).jpg,A white promotional truck is parked on a sunny street with bright informational panels on its side and colorful flags mounted on top while trees and nearby buildings form the background.
ship (232).jpeg,A medium-sized green and white sailing ship with multiple brown sails carries several people across the sea during sunset.
pickup_truck (33).jpg,"A red Mitsubishi SUV with a black license plate is parked angled to the left in a spacious exhibition hall, with a white banner displaying a red Mitsubishi logo behind it."
suv (120).jpg,A white Hyundai SUV is parked on the side of a street lined with trees and buildings during the daytime.
truck (393).jpg,A white Isuzu box truck with a metal cargo body is parked on a street beside residential buildings during daytime.
helicopter (303).jpg,"A small helicopter with a white base and black rear, with a three-blade propeller, two-blade tail rotor, and skid landing gear, lands on a lawn with its doors open and a clear sky visible."
bulldozer (43).jpg,There is a yellow bulldozer from the CAT brand on a white background.
police_car (402).jpg,Two police officers wearing black uniforms and carrying guns are standing next to a police car with its lights on.
m9_ppe (89).jpg,A man wearing a safety helmet and a bright yellow work vest is stretching his right arm to the side while keeping his left fist on his waist.
bird (67).jpg,A brown flycatcher sits on a leafy branch of a tree during the daytime.
suitcase (14).jpg,"During the day, a woman in her 40s is walking holding an intact large suitcase in her left hand and an intact small suitcase in her right hand."
concrete_truck (434).jpg,A white truck with a cement mixer on the back is parked in front of a building.
bicycle (10).jpg,A man wearing a green shirt and a yellow wig rides a bicycle down a street.
convertible (171).jpg,"A bright yellow convertible car with black wheels is parked on a paved road beside green trees, captured from a front-left angle under soft daylight with clear reflections on its glossy surface."
ambulance (142).jpg,"A medium ambulance with plate 74E4240 is on a lift, no people visible."
airplane (384).jpg,"A completely unmarked white regional jet, featuring the small German registration 'D-AWBA' near the rear door, flies with its landing gear partially extended against a uniformly light grey and overcast sky."
m7_ppe (337).jpg,A woman with long blonde hair is seen from the side wearing a clear face shield that is secured by a grey and white strap.
quad (321).jpg,A black ATV stands parked on a concrete surface next to a gray wall lined with white rocks during the daytime.
concrete_truck (183).jpg,"A large cement truck with the word ""Steel"" written on it is parked on a dirt road."
suitcase (206).jpg,Two adults are walking down stairs holding medium-sized suitcases.
walking_person (250).png,"A pedestrian dressed in black pants and a dark top walks across a wide crosswalk at a large intersection at night, illuminated by streetlights and vehicle headlights."
uv (483).jpg,Four friends wearing stylish casual attire gather around a white multi-seat golf cart on a bright green lawn.
rv (10).jpg,Four adults pose and smile near a white RV with a green awning in a grassy field at sunset.
limousine (79).jpg,"A large, yellow vintage limousine with a red light on top and a license plate is parked on a dirt road in front of a small wooden house during the daytime ."
license_plate (313).jpg,"A silver Kia sedan is parked on a wet road during daytime, displaying a white license plate with 27머 4982 while another dark vehicle and trees appear in the background."
dog (447).jpg,A dog is standing next to the river.
m3_ppe (348).jpg,An older worker in a helmet gestures while holding a tablet near shipping containers.
ambulance (470).jpg,A medium ambulance van shows plate 9981256; no people are around.
