filename,caption
quad (418).jpg," A black ATV sits on an artificial green turf surface, positioned near the brightly lit, rectangular corner of a swimming pool at night."
m11_ppe (149).jpg,"Two adult males wear blue protective uniforms with orange collars, orange safety helmets, and green full-body safety harnesses with orange straps, with the man on the right facing forward and the man on the left showing his back. "
helicopter (241).jpg,"Two orange-clad people are on board and flying in the sky in a gray medium helicopter with a five-leaf propeller, a phenestron-style tail rotor, two large wheels on each side of the front and one small wheel in the center of the back."
sports_car (154).jpg,"A vibrant red coupe stands prominently on display at a bustling indoor auto show, where many people browse the surrounding vehicles and one individual sits inside the driver's seat under bright artificial lighting."
bird (497).jpg,A white rooster stares into the distance during the daytime.
m1_ppe (201).jpg,A worker wearing a yellow safety helmet and a mustache is wearing a blue work suit.
bus (140).jpg,A man in a white shirt stands and looks at a green and blue 'Sarke Travels' bus that is parked on a dirt road under the shade of a large tree.
limousine (234).jpg,A large white Hummer stretch limousine is parked on a grassy field under a bright blue sky during the daytime .
concrete_truck (321).jpg,A large cement truck is driving down the road with a cement mixer on the back.
forklift (152).jpg,"An adult male operates an orange and gray Toyota forklift, carrying multiple cardboard boxes on a pallet in a warehouse during the daytime. "
m1_ppe (427).jpg,A worker wearing a white safety helmet walks obliquely with his hands raised and outstretched in front of the vehicle while wearing protective gear.
walking_person (463).png,An adult male wearing a light jacket stands near a white van and a car on a street at night.
pickup_truck (395).jpg,"A pale orange garage on the left, featuring a white sign with ""BODY SHOP"" in navy letters, stands behind a silver pickup truck that is completely crushed and destroyed, missing its tailgate and rear tires, under a blue sky with a line of utility poles in the background."
motorbike (13).jpg,An adult male wearing a white helmet sits on a yellow motorbike on a beach during sunset.
holdingGun_person (298).jpg,"An adult man wearing a black mask, a black jacket and black gloves is holding a car window and looking over the window."
fuel_truck (15).jpg,"A male adult wearing a green uniform with an ""AVIATION"" logo is standing beside a small propeller plane, operating a hose from a green and yellow fuel truck to refuel the aircraft on a sunny daytime tarmac."
m1_ppe (256).jpg,A worker in a yellow safety helmet and blue work suit is taking a picture with safety goggles and harnesses on.
convertible (255).jpg,"A bright red convertible is parked on a gravel driveway beside an old stone railing, with bare trees and a cloudy sky in the background."
m4_ppe (436).jpg,A man is wearing clear face shield.
m5_ppe (318).jpg,"A man with a yellow earmuffs, wearing a black short-sleeved shirt, is standing and looking at the man behind him in the daytime."
taxi (482).jpg,Gray and orange sedan taxis stop on the road with adult men and women waiting nearby on the sidewalk under a clear daytime.
bulldozer (204).jpg,"During the day, a yellow bulldozer is parked on the dirt road, and several similar yellow bulldozers are parked nearby."
sports_car (469).jpg,A red Corvette coupe rests on an asphalt road next to a body of water under a beautiful pink and orange sunset sky.
road_roller (220).jpg,"A used yellow grader with an enclosed cab, used for leveling earth, is parked on a gravel road during the day, with two adult males in high-visibility vests and hard hats standing nearby."
helicopter (77).jpg,"A four-leaf propeller, a light brown medium-sized helicopter with two large wheels in front of it, has two people on board, and a person stands on the door with the door open, landing at a landing site with a lot of trees behind it."
concrete_truck (158).jpg,A yellow truck with a large yellow cement mixer on the back.
m3_ppe (359).jpg,A construction worker in an orange vest shrugs with both hands raised.
ship (207).jpeg,A large white cruise ship named “COSTA ATLANTICA” with yellow and blue funnels sails away from the port in clear daylight.
car (300).png,"At night, a white sedan and a blue electric city bus are driving through a brightly lit intersection in the city."
fallen_person (418).jpg,"A male tennis player in white attire lies on his back on a green grass court with a raised leg and arms, celebrating or showing relief, with a racket nearby."
rv (29).jpg,"A white van with a solar panel is parked near a body of water during the daytime, with an adult male resting on the ground next to a folding table and an adult female in a yellow shirt sitting nearby, all surrounded by dense green foliage and tall trees."
police_car (396).jpg,"""A blue and white police car is parked on the street."
rv (101).jpg,An adult male rides a yellow bicycle with a red basket in front of a large white RV during the daytime. 
fire (186).png,"A large fire burns through a dense forest, casting an orange glow into the smoky night sky."
ship (249).jpeg,A small white-and-blue sailboat moves across the water during daytime as one person stands near the stern with folded sails hanging from the mast.
fuel_truck (233).jpg,"The rear of a white fuel tanker displays multiple hazard signs, including numbers 30-1202 and 33-1203 and foreign text warnings, with a Honda logo visible in the background during the daytime."
m3_ppe (249).jpg,"Three workers are having a discussion in a warehouse, with one person pointing a finger."
m10_ppe (27).jpg,An adult male carries a blue-suited mannequin while wearing an orange hard hat and an orange reflective vest during the daytime.
license_plate (96).jpg,A black vehicle displays a temporary white license plate 049912 during daytime.
m11_ppe (6).jpg,An adult man in a navy shirt over a black T-shirt is looking sideways in a red earmuff with a black cover and an adjustable headband.
dump_truck (291).jpg,"A driver operates a large yellow articulated dump truck with the number ""DT 108"" on its front as it moves along a dirt path under a clear sky."
pickup_truck (353).jpg,"A glossy white, 2-seater pickup truck with a blurred license plate is angled to its front-right on a road, with a black building and a red building behind it visible in the background."
cat (17).jpg,A black kitten is lying on the floor in front of a stack of colorful pillows.
excavator (411).jpg,A yellow LYNCH excavator sits on dirt ground under a cloudy daytime sky.
m2_ppe (155).jpg,A group of workers and supervisors are discussing blueprints at a site. They are wearing white helmets and yellow reflective vests.
airplane (400).jpg,"A white Airbus A340 airliner, featuring multiple small airline logos including 'VARIG', 'Thai', 'SAS', and 'Lufthansa' on its forward fuselage and a black Star Alliance logo on its black tail, sits parked on a concrete ramp next to a tan hangar wall under a bright blue sky with scattered cumulus clouds."
road_roller (496).jpg,"A used red Dynapac tamping foot road roller with an open canopy, designed for compacting cohesive soils, is actively operating on a dirt road during the day, with an adult male in a white shirt and blue jeans seen inside the cab."
crane_truck (318).jpg,A white Hino 500 truck with license plate 51C-988.43 equipped with a red Unic crane arm stands parked on a gravel lot during the daytime.
m3_ppe (40).jpg,Two cheerful construction workers wearing hard hats and safety vests shake hands on a building site.
motorbike (213).jpg,"A young man wearing a white helmet and a backpack rides a red motorbike on a street during the daytime, with another motorbike visible in the background."
uv (179).jpg,A smiling man drives a white golf cart while a woman in a yellow dress sits next to him on a paved path.
limousine (133).jpg,A damaged black Lincoln stretch limousine with missing license plates is parked on a dirt lot next to a white trailer during the daytime .
rickshaw (449).jpg,A black and white auto-rickshaw travels along a road with utility poles in the background during the daytime.
fire (130).png,"A large fire engulfs a building with thick smoke billowing into the sky, while two firefighters, one adult male and another adult male, stand by observing the scene during daytime."
excavator (325).jpg,"An orange CASE excavator sits on dirt ground with a container in the left background, a fence in the right background, under an overcast daytime sky."
convertible (46).jpg,"A red Aston Martin convertible is shown from the rear, parked on a checkered surface. Its sleek lines, dual exhausts, and elegant taillights emphasize its luxury and performance."
train (262).jpg,A silver commuter train with yellow and blue passes the crossing as workers in orange vests manage the site in daytime.
fighting_person (84).jpg,"Indoors, two adult men and an adult woman are involved in a fight, the two men grabbing each other’s clothes and pushing, while the woman stands between them trying to stop the fight; the men are wearing a blue cap with a navy shirt and a checkered suit, and all are standing."
fire (101).png,"A large fire rages on a tall building during the daytime, with heavy smoke billowing into the clear blue sky."
convertible (324).jpg,"A deep, midnight-blue convertible rests beside a sunlit roadside, its smooth, rounded body reflecting patches of sky and trees while the light beige top lies folded like soft fabric at the rear, chrome wheels glint against the grass, and the fenced industrial backdrop contrasts with the car’s calm, elegant glow."
m8_ppe (278).jpg,"Young adults wear white masks and gloves, one posing boxing while others work at computers during daytime."
dog (154).jpg,Two dogs are running in the dirt.
suitcase (6).jpg,Men and women in their 20s are posing with large suitcases.
sports_car (121).jpg,"A white and blue classic MGB GT racing coupe, with a driver wearing a helmet, speeds along a track during daytime, set against a blurred background of green grass and foliage."
rickshaw (152).jpg,"An adult male driver drives a red and black cycle-rickshaw, covered by a black umbrella, on a bustling street lined with shops and hanging banners at sunset."
concrete_truck (14).jpg,A white Iveco concrete mixer truck is parked in a gravel lot on a sunny day.
recycling_truck (269).jpg,A white truck is driving down the street with a full bed of garbage.
tractor (312).jpg,"A red tractor with a canopy and driver is positioned behind a white tractor, which is in front of another white tractor, all on a dirt path next to a body of water under a clear sky."
smoke (368).jpg,"A large amount of smoke billows from a brush fire in a hilly, vegetated landscape during the daytime."
fire_truck (220).jpg,A red fire truck numbered 11 drives along the road during the day with its side profile visible.
limousine (99).jpg,A young woman in a pink gown holds a bouquet of flowers and smiles while standing next to a white stretch limousine on a sunny daytime .
m4_ppe (444).jpg,A woman is wearing clear face shield.
fire (391).png,Firefighters walk along a road through a large fire at night time.
m3_ppe (51).jpg,A confident worker in a yellow hard hat and safety vest stands with his arms crossed before a wall of shipping containers.  
walking_person (375).jpg,"At night, a yellow van is parked in front of Saechangwon Daycare Center and the streetlights are on."
police_car (331).jpg,"A city street with two NYPD vehicles, a police car and a K-9 unit, parked in front of a large building."
limousine (443).jpg,A white SUV-style stretch limousine drives down a multi-lane highway next to a blue Ford SUV on an overcast day .
walking_person (391).jpg,"A person wearing a wide-brimmed hat, black short-sleeved shirt, and dark pants is walking down a concrete path surrounded by a fence."
stealing_person (144).jpg,A man in a black leather jacket holds a knife to another man's throat while a film camera is positioned nearby.
m2_ppe (252).jpg,A man wearing a red helmet is explaining something about a wall to a group of people inside a building.
uv (429).jpg,White utility cart is parked along a shaded asphalt road in a park-like setting under bright sunlight.
m9_ppe (478).jpg,"A person wearing black shoes, a white mask, and a yellow full-body protective suit is walking diagonally."
fighting_person (342).jpg,"During the daytime, young men and women wearing school uniforms stand and fight in front of a young man in a school uniform who sits on the ground covering his head with his hands. "
rickshaw (28).jpg,"A young adult male rickshaw puller, wearing a blue headscarf and black apron, pulls a black rickshaw while a young adult female passenger, draped in a red blanket, smiles from its red-cushioned seat during the day."
fuel_truck (104).jpg,A white 'SCHENK' fuel truck with its tanker covered in a white tarp is positioned next to a large concrete pillar and exposed metal piping at an industrial facility during the daytime.
bus (69).jpg,A line of three identical green Eicher buses is parked on the shoulder of a rural road during the daytime.
sitting_person (8).jpg,A man and a woman sit on a couch in a living room discussing documents while a laptop and a coffee table are in front of them.
uv (134).jpg,A dirty white golf cart with a flat tire sits in a cluttered repair area filled with old electronic devices.
m4_ppe (299).jpg,An adult male is wearing a white helmet and yellow earmuffs.
police_car (185).jpg,A blue and white police car is parked in a parking lot next to other cars.
dump_truck (18).jpg,A red dump truck unloads dirt onto a sandy beach under a clear blue sky.
dump_truck (95).jpg,A red dump truck unloads dirt at a construction site under a partly cloudy sky.
crane_truck (441).jpg,A white Hyundai truck equipped with a red Unic crane is parked on a paved road during the daytime.
airplane (353).jpg,"A white Baltic International jet, featuring a thin red stripe along the fuselage, the text ""Baltic International"" in black, and the registration ""YL-LBV"" near the tail, sits on a sunny tarmac with a distinct red and white tail, while a Lufthansa-painted Condor aircraft rests behind it next to a large, modern terminal building."
m4_ppe (216).jpg,"A male worker is waving his hand while wearing a white helmet, orange vest, and blue mask."
dump_truck (118).jpg,"A worker in a bright orange uniform gestures towards a line of massive yellow mining trucks moving across a dusty, industrial landscape under a cloudy sky."
cat (51).jpg,"A black cat is standing among dense green plants in a lush, overgrown outdoor area."
fire (455).png,A large fire rages through the dry brush and trees under a cloudy daytime sky.
bicycle (114).jpg,A woman wearing a red jacket and a helmet is riding a bicycle down a road.
dump_truck (252).jpg,"A massive yellow haul truck sits on a dusty surface in front of a tiered, rocky mine wall under a clear blue sky."
m7_ppe (356).jpg,"A man in a checkered shirt smiles for the camera while wearing a clear face shield that has a grey headband with the ""Tower Plus Inc."" logo."
suitcase (276).jpg,A large blue carrier is placed next to a dog and a man in a blue suit.
bulldozer (93).jpg,A yellow bulldozer is next to the building during the bright day.
recycling_truck (8).jpg,A row of green buses are parked next to each other on a street.
rickshaw (6).jpg,"A middle-aged man sits in the driver's seat of a black and white auto-rickshaw, holding something small in his hands during the daytime."
m6_ppe (102).jpg,"Four people in purple work clothes, red work vests, yellow safety helmets, and red safety harnesses touch a rope."
car (298).png,"At night, a stream of cars including a gray Hyundai sedan and a black SUV drives under green lights on a wide urban road."
m4_ppe (83).jpg,A young woman is wearing a white face mask.
m4_ppe (326).jpg,A young woman is wearing a white face mask.
bulldozer (132).jpg,"At sunset when the sunset is visible, the JCB brand's bulldozer is full of stones in the bucket, and parts like excavators are attached behind the bulldozer."
train (284).jpg,A white passenger train moves on the tracks with no people visible in bright daytime.
walking_person (363).png,"A man wearing a blue striped t-shirt and shorts walks away on the crosswalk, while a woman in a pink t-shirt and jeans crosses the street at a crosswalk at night."
ambulance (307).jpg,A large ambulance is parked with plate 9982 2054; no people are visible.
walking_person (249).png,A woman wearing a white t-shirt and loose grey pants walks along the sidewalk at a night intersection while a yellow bus drives in the background.
fire (357).png,"A large fire rages at night, illuminating the sky with an intense orange glow behind silhouetted palm trees."
helicopter (207).jpg,"A black small helicopter with a two-leaf propeller, a two-leaf tail rotor system and a skid landing gear has two people on board and the door is open, flying over a wave beach."
taxi (342).jpg,Gray sedan taxi drives on the road surrounded by adult men and women walking with no visible brand or license plate during a clear daytime.
fire (447).png,"A large fire rages on a hillside, consuming trees and vegetation under a dark sky, with smoke billowing upwards."
recycling_truck (14).jpg,A row of green tractors are parked next to each other on a concrete surface.
forklift (19).jpg,"A blue truck with a flatbed trailer, loaded with shrink-wrapped brick pallets, is parked near a yellow forklift moving a pallet of bricks in an industrial yard during the daytime. "
dump_truck (489).jpg,"A white utility truck, a dump truck filled with dirt, and a yellow backhoe are parked on a suburban street next to a residential house."
fire (472).png,Several adult males in protective gear survey a large wildfire burning on a hillside during daytime.
m6_ppe (65).jpg,"A man in a red safety helmet, red work clothes, and sunglasses carries lumber on one shoulder with both hands."
road_roller (365).jpg,"A used orange Dynapac tamping foot road roller with an enclosed cab, designed for compacting cohesive soils, is actively working on a construction site during the day, with another smaller compactor visible in the background."
tractor (204).jpg,A man drives a red tractor with a white canopy and large white-rimmed rear tires through a dirt field surrounded by lush green trees and foliage under a clear blue sky.
dump_truck (271).jpg,A red dump truck is filled with asphalt while a paving machine is seen in the background.
sports_car (287).jpg,"A vibrant blue and yellow Chevrolet touring car, displaying the number 18 and numerous sponsor logos, races on an asphalt track during the bright daytime."
rv (493).jpg,"An adult woman with curly hair drives a van with a small white dog in the passenger seat, a blue surgical mask hanging from the gear shift, and trees visible through the windshield during daytime. "
cat (217).jpg,A fluffy orange cat with a red collar looks toward the camera against a metallic background.
sports_car (228).jpg,"A black heavily modified Toyota Supra sports coupe, bearing numerous sponsor decals including Yokohama and MVP, rests on a concrete lot under a clear daytime sky, bordered by a green hedge and distant structures."
m1_ppe (331).jpg,"A fat worker in a harness is taking a photo inside the building, facing the front, at an angle to the side."
convertible (202).jpg,"A gold-colored convertible with a beige interior is parked in bright sunlight, its glossy body and chrome accents reflecting the light while it sits in front of a dark, modern backdrop."
m1_ppe (252).jpg,A female worker in a red safety helmet is taking a picture with a smile on her harness.
m3_ppe (103).jpg,A worker in a yellow helmet and vest gives a thumbs up at a construction site.
dump_truck (161).jpg,"A yellow excavator digs into a pile of dirt next to a large building under construction, with trucks waiting nearby under a clear blue sky."
holdingGun_person (142).jpg,"An adult man wearing a green long-sleeved shirt, jeans and a navy bag is picking up a bunch of money at the store."
convertible (150).jpg,"A silver convertible sports car sits in a clean, minimalist white studio setting. Its design is refined — long hood, low stance, and an elegant front grille that gives it a sophisticated, timeless look. The car radiates quiet confidence, like something meant more for grand tours than for showing off."
m10_ppe (439).jpg,"An adult man works on a wooden roof structure during daytime, wearing a blue and black fall arrest harness as PPE."
fallen_person (28).jpg,A construction worker in a yellow hard hat kneels to aid an injured colleague lying on the ground among scattered building materials and yellow tarps.
bicycle (393).png,A street with a yellow line and a brick wall with a sign on it.
m8_ppe (50).jpg,"During the day outdoors, a young adult with a clear face shield and blue clips looks at the camera."
ambulance (475).jpg,A medium ambulance van is parked with unreadable plate; no one is visible.
fire_truck (252).jpg,A red-and-black Squad 55 fire truck stands parked on the road in daytime.
fire_truck (111).jpg,A red fire truck labeled Squad is parked on the road in daylight with one adult male’s face visible nearby.
motorbike (115).jpg,An adult male wearing a black helmet and an adult female wearing a red helmet ride a red motorbike with two children during the daytime.
pickup_truck (214).jpg,"On the left side of a wide road, a white pickup truck is seen from behind, its metal-fenced cargo bed holding an adult in a light blue shirt and a purple hat along with various items."
taxi (326).jpg,A white Kia SUV taxi stands on the road with license plate 31사 9304 under cloudy daylight.
bird (162).jpg,A white flamingo walks to the left on the sand near the sea during the daytime.
bulldozer (361).jpg,A yellow bulldozer stands in front of a small snowdrift on a cloudy day.
police_car (108).jpg,A man wearing a mask and a blue shirt is holding a red object in front of a red bus and police car.
stealing_person (372).jpg,A person wearing a blue glove sprays green paint onto a yellow wall covered in colorful graffiti.
bicycle (383).jpg,A group of bicyclists wearing helmets and riding bikes down a street.
fuel_truck (366).jpg,A white fuel truck with a white and blue tanker is positioned directly under the wing and engine of a wide-body passenger jet on the tarmac during the daytime.
concrete_truck (138).jpg,A large metal object with a triangle shape on the front of it.
road_roller (338).jpg,"A used yellow Volvo tamping foot road roller with a ROICO 1838 decal, designed for compacting sandy soils, is actively working on a dirt road during the day, with an adult male operator visible inside the open canopy."
train (272).jpg,A red and gray passenger train speeds out of a tunnel with no people visible in daytime.
bus (408).jpg,"Passengers disembark from a black 'HANIF' coach bus on a dusty roadside, while a man in a blue shirt stands with his luggage in the foreground."
motorbike (350).png,"A black delivery motorbike with a red cargo box is parked on a sidewalk, as a silver taxi drives past on the street during the daytime."
bus (405).jpg,"A white bus with red and blue graphics is stopped in traffic as two men lean out the open door and window, smiling."
helicopter (395).jpg,"A camouflaged small helicopter with a five-blade propeller, tail rotor, and skid landing gear flies over cloudy weather."
ambulance (127).jpg,"A medium Hyundai ambulance with plate 796965 is parked, no people visible."
m3_ppe (158).jpg,Two workers in helmets inspecting shipping containers at a port.
helicopter (220).jpg,"A person is in a yellow helicopter with a four-leaf propeller, a two-leaf tailrotor and a skid landing gear, and flies over a woody thicket."
crane_truck (395).jpg,A white truck with a red crane arm next to a blue truck carries a black car in its cargo bed during the daytime.
m5_ppe (267).jpg,"A man in his 20s or 30s, wearing a black short-sleeved shirt and a yellow earmuffs, is using both hands to properly adjust his yellow face protection gear in the daytime."
jeep (150).jpg,"A white jeep drives dusty ground, a large line of park off-road vehicles at the base of a steep, forested mountain range during the daytime."
rickshaw (335).jpg,A monochromatic auto-rickshaw carrying an adult male driver and an adult passenger travels along a blurred city street during the daytime.
m4_ppe (235).jpg,Construction workers are working on rebar while wearing white helmets and vests.
rv (467).jpg,"A person sits atop a dark van with the rear hatch open, illuminated by lights from within, under a vast, star-filled night sky. "
stealing_person (101).jpg,A man in black clothing and gloves cautiously climbs over a brick wall into a garden.
stealing_person (83).jpg,"A father instructs his daughter on aiming a rifle at a shooting range, both wearing protective earmuffs and eyewear."
stealing_person (157).jpg,A person wearing a black ski mask and hoodie attempts to break into a building with a crowbar.
quad (410).jpg,"A black and red ATV, featuring bright red frame components and white suspension springs, sits parked on a gray asphalt surface next to a generic black car and a building with graphic lettering during the daytime."
m10_ppe (66).jpg,"An adult man, dressed in a white suit, black safety harness, and orange helmet, stands on a wind turbine at daytime, gazing over a vast forested landscape."
fighting_person (499).jpg,"During the day, an adult man in a gray top and beige pants and an adult man in a white top with jeans stand facing each other while struggling."
ambulance (282).jpg,A medium ambulance van has no readable plate and no people are present.
